{
  "lang": "ru",
  "title": "АвтоТАЗ Кликер",
  "subtitle": "30 уровней, динамические заказы и путь к суперкару",
  "category": [
    "Казуальные",
    "Экономические"
  ],
  "tags": [
    "тапалки",
    "бесконечные",
    "с прокачкой",
    "на русском",
    "мемы",
    "веселые",
    "браузерные",
    "мобильные",
    "без скачивания",
    "машины",
    "простые",
    "увлекательные"
  ],
  "keywords": [
    "автотаз",
    "мердж",
    "машины",
    "автозавод",
    "кликер",
    "суперкар",
    "заказы",
    "конвейер",
    "карьера",
    "директор"
  ],
  "seo_description": "АвтоТАЗ Кликер — объединяй 30 уровней деталей, выполняй динамические заказы, развивай завод и выпусти собственный суперкар.",
  "about": "АвтоТАЗ Кликер — сатирическая merge-игра про автомобильный завод с 30 ступенями производства. Начни с болта, освой шайбы, подшипники, тормоза, проводку, датчики, аккумулятор, ЭБУ/CPU, двигатель, электромотор, шасси и кузов, а затем разверни модельный ряд до турбо-прототипа и собственного суперкара.\n\nОбъединяй одинаковые детали на линии 4×4. Выполняй смены 30-дневного производственного плана, получай жетоны модернизации и развивай Оснастку, КБ и Логистику. Снабжение постепенно выдаёт детали более высокого уровня, поэтому поздняя игра не сводится к бесконечным болтам.\n\nВ участке отгрузки собирай динамические заказы: после каждой отправки меняются типы и количество требуемых деталей. Перетаскивай нужные компоненты с merge-поля прямо в заказ, запускай комплект с конвейера и получай карьерные очки, жетоны и детали повышенного уровня.\n\nОбычные идеи тратятся на предложения руководству. Золотая идея гарантирует полезную резолюцию и временно повышает шанс появления более высоких деталей. Расти от младшего инженера до легенды завода, открой весь каталог 30/30 и выпусти суперкар.",
  "how_to_play": "На ПК нажимай «Произвести деталь», затем перетаскивай предмет мышью на такой же предмет для слияния. На мобильном используй касания и перетаскивание пальцем.\n\n• Две одинаковые детали превращаются в предмет следующего уровня.\n• Оставляй свободные клетки на поле 4×4.\n• Для участка отгрузки перетащи нужную деталь в слот заказа или нажми «Сдать».\n• После заполнения рецепта нажми «Запустить с конвейера».\n• Кнопка «План» открывает 30-дневные задания и модернизации цеха.\n• Идеи отправляются руководству; Золотая идея даёт приоритет и усиление снабжения.\n• Кнопки с символом 📺 запускают только добровольную рекламу и заранее показывают награду.\n• «Рейтинг» открывает таблицу по числу собранных деталей."
}
